{
  "id": "creatine_daily",
  "name": "3–5-Gram Daily Creatine",
  "title": "Take 3 to 5 grams of creatine monohydrate daily.",
  "benefit": "More strength and possibly sharper thinking.",
  "subtitle": "Daily Supplement",
  "rationale": "Creatine monohydrate is the most studied performance supplement there is, with consistent strength and lean-mass results.",
  "kind": "nutrition",
  "targets": [
    "Strength",
    "Training",
    "Cognition"
  ],
  "durationMinutes": 2,
  "evidence": {
    "grade": "strong",
    "summary": "Position-stand evidence supports creatine monohydrate as safe and effective for strength and lean mass across hundreds of trials.",
    "sources": [
      {
        "label": "ISSN creatine position stand",
        "url": "https://pubmed.ncbi.nlm.nih.gov/28615996/"
      }
    ]
  },
  "indications": [
    "Strength training is consistent but unsupplemented.",
    "Strength numbers have been flat for two months or more."
  ],
  "avoidWhen": [
    "Kidney disease or impaired renal function unless cleared by a physician."
  ],
  "guide": {
    "url": "https://my.clevelandclinic.org/health/treatments/17674-creatine",
    "source": "Cleveland Clinic"
  }
}
