{
  "id": "nature_dose",
  "name": "120-Minute Nature Dose",
  "title": "Spend 120 minutes per week in nature.",
  "benefit": "Lower stress and better mood.",
  "subtitle": "Weekly Recovery",
  "rationale": "Two hours a week in green space is the threshold where self-reported health and wellbeing measurably improve.",
  "kind": "recovery",
  "targets": [
    "Stress",
    "Mood",
    "Recovery"
  ],
  "durationMinutes": 60,
  "evidence": {
    "grade": "moderate",
    "summary": "In a large population study, 120-plus weekly minutes in nature associated with higher self-reported health and wellbeing, in any session pattern.",
    "sources": [
      {
        "label": "120 minutes in nature and wellbeing study",
        "url": "https://pubmed.ncbi.nlm.nih.gov/31197192/"
      }
    ]
  },
  "indications": [
    "Weeks pass entirely indoors between home, transit, and office.",
    "Walks happen but only through built environments.",
    "Stress stays elevated despite adequate sleep and training."
  ],
  "guide": {
    "url": "https://www.apa.org/topics/stress/nature",
    "source": "APA"
  }
}
