{
  "id": "deliberate_hobby_switch",
  "name": "Absorbing Hobby",
  "title": "End hard workdays in an absorbing unrelated hobby.",
  "benefit": "Real mental recovery in the evening.",
  "subtitle": "Evening Recovery",
  "rationale": "Only a genuinely absorbing alternative interrupts work rumination, which passive rest leaves running.",
  "origin": "Winston Churchill credited painting with restoring him through crises.",
  "kind": "recovery",
  "targets": [
    "Detachment",
    "Recovery",
    "Mood"
  ],
  "durationMinutes": 60,
  "evidence": {
    "grade": "moderate",
    "summary": "Recovery research finds mastery experiences predict recovery better than passive rest, matching Churchill's change-is-the-master-key claim.",
    "sources": [
      {
        "label": "Work detachment meta-analysis",
        "url": "https://pubmed.ncbi.nlm.nih.gov/28133454/"
      },
      {
        "label": "Churchill, Painting as a Pastime",
        "url": "https://gutenberg.ca/ebooks/churchillws-paintingasapastime/churchillws-paintingasapastime-00-h-dir/churchillws-paintingasapastime-00-h.html"
      }
    ]
  },
  "indications": [
    "Evenings are passive but the mind stays at work.",
    "A skill hobby exists but never gets scheduled."
  ],
  "guide": {
    "url": "https://gutenberg.ca/ebooks/churchillws-paintingasapastime/churchillws-paintingasapastime-00-h-dir/churchillws-paintingasapastime-00-h.html",
    "source": "Winston Churchill"
  }
}
