{
  "id": "grip_carries_hangs",
  "name": "Carries and Hangs",
  "title": "Add farmer's carries and dead hangs weekly.",
  "benefit": "A stronger grip and more durable shoulders.",
  "subtitle": "Strength Work",
  "rationale": "Grip strength tracks total-body strength closely, and carries and hangs train it along with shoulders and trunk.",
  "origin": "Peter Attia treats grip work as a longevity marker.",
  "kind": "training",
  "targets": [
    "Strength",
    "Durability",
    "Longevity"
  ],
  "durationMinutes": 15,
  "evidence": {
    "grade": "emerging",
    "summary": "The grip-mortality association is robust and dose-dependent in cohorts; that training grip moves outcomes is extrapolation from the marker.",
    "sources": [
      {
        "label": "Grip strength and mortality PURE cohort",
        "url": "https://pubmed.ncbi.nlm.nih.gov/25982160/"
      },
      {
        "label": "Peter Attia on grip strength",
        "url": "https://peterattiamd.com/avoiding-injury-part-ii-grip-strength/"
      }
    ]
  },
  "indications": [
    "Strength sessions skip carries and hangs entirely.",
    "Grip fails before the rest of the body on big lifts."
  ],
  "avoidWhen": [
    "Acute shoulder or elbow injury."
  ],
  "guide": {
    "url": "https://peterattiamd.com/avoiding-injury-part-ii-grip-strength/",
    "source": "Peter Attia"
  }
}
