{
  "id": "alcohol_sleep_cutoff",
  "name": "Alcohol Cutoff",
  "title": "Stop alcohol at least three hours before bed.",
  "benefit": "Better sleep quality and sharper mornings.",
  "subtitle": "Alcohol Timing",
  "rationale": "Alcohol close to bedtime suppresses REM and fragments the second half of the night even at moderate doses.",
  "kind": "nutrition",
  "targets": [
    "Sleep quality",
    "Recovery",
    "HRV"
  ],
  "durationMinutes": 15,
  "evidence": {
    "grade": "strong",
    "summary": "Experimental studies consistently show pre-sleep alcohol suppresses REM and fragments the second half of the night even at moderate doses.",
    "sources": [
      {
        "label": "Alcohol and normal sleep review",
        "url": "https://pubmed.ncbi.nlm.nih.gov/23347102/"
      }
    ]
  },
  "indications": [
    "Alcohol is the default wind-down after hard days.",
    "Sleep tracking shows depressed HRV or fragmented sleep after drinking evenings.",
    "Night waking clusters after social dinners."
  ],
  "guide": {
    "url": "https://www.sleepfoundation.org/nutrition/alcohol-and-sleep",
    "source": "Sleep Foundation"
  }
}
