{
  "id": "sauna_regular",
  "name": "Sauna 2-3x",
  "title": "Sauna two to three times per week.",
  "benefit": "Better recovery and sleep during heavy weeks.",
  "subtitle": "Heat Exposure",
  "rationale": "Two to three weekly sessions is where the dose-response association in cohort data begins to show.",
  "kind": "recovery",
  "family": "heat_exposure",
  "tier": "intermediate",
  "tierTarget": "2-3 sauna sessions per week",
  "targets": [
    "Recovery",
    "Cardiovascular fitness",
    "Sleep"
  ],
  "durationMinutes": 20,
  "evidence": {
    "grade": "moderate",
    "summary": "Cohort data show a dose-response association: 2-3 weekly sauna sessions track with lower cardiovascular mortality than one.",
    "sources": [
      {
        "label": "Sauna bathing and cardiovascular mortality cohort",
        "url": "https://pubmed.ncbi.nlm.nih.gov/25705824/"
      },
      {
        "label": "Sauna bathing health benefits review",
        "url": "https://pubmed.ncbi.nlm.nih.gov/30077204/"
      }
    ]
  },
  "indications": [
    "Evening tension and post-training soreness persist through the week."
  ],
  "avoidWhen": [
    "Pregnancy, cardiovascular instability, recent alcohol, or heat intolerance."
  ],
  "guide": {
    "url": "https://www.hubermanlab.com/newsletter/deliberate-heat-exposure-protocols-for-health-and-performance",
    "source": "Huberman Lab"
  }
}
